<?xml version="1.0" encoding="UTF-8"?>
<!-- UN-10-27-03 -->

<CodeGen:Document xmlns:xsi="http://www.w3.org/2001/XMLSchema-instance"
       xmlns:CodeGen="http://www.mcs.anl.gov/CodeGen"
       xsi:schemaLocation="http://www.mcs.anl.gov/CodeGen CodeGenerator.xsd"
       nr_entries="1" nr_templates="1" outfile="parse_method_decl.inc">

  <CodeGen:RepeatableCode nr_versions="41">
    <CodeGen:CodeTemplate nr_entries="4">
      <CodeGen:StaticCode text="void on"/>
      <CodeGen:DynamicCodePlaceholder hook="3"/>
      <CodeGen:StaticCode text="(const XAIFBaseParserHelper&#38; passingIn, XAIFBaseParserHelper&#38; passingOut);"/>
      <CodeGen:LineBreak/>
    </CodeGen:CodeTemplate>
    <CodeGen:CodeVersion>
      <CodeGen:DynamicCode hook_ref="3" text="AliasMapEntry"/>
    </CodeGen:CodeVersion>
    <CodeGen:CodeVersion>
      <CodeGen:DynamicCode hook_ref="3" text="AliasMap"/>
    </CodeGen:CodeVersion>
    <CodeGen:CodeVersion>
      <CodeGen:DynamicCode hook_ref="3" text="AliasRange"/>
    </CodeGen:CodeVersion>
    <CodeGen:CodeVersion>
      <CodeGen:DynamicCode hook_ref="3" text="AliasSingle"/>
    </CodeGen:CodeVersion>
    <CodeGen:CodeVersion>
      <CodeGen:DynamicCode hook_ref="3" text="Argument"/>
    </CodeGen:CodeVersion>
    <CodeGen:CodeVersion>
      <CodeGen:DynamicCode hook_ref="3" text="ArgumentList"/>
    </CodeGen:CodeVersion>
    <CodeGen:CodeVersion>
      <CodeGen:DynamicCode hook_ref="3" text="ArgumentSymbolReference"/>
    </CodeGen:CodeVersion>
    <CodeGen:CodeVersion>
      <CodeGen:DynamicCode hook_ref="3" text="ArrayAccess"/>
    </CodeGen:CodeVersion>
    <CodeGen:CodeVersion>
      <CodeGen:DynamicCode hook_ref="3" text="ArrayIndex"/>
    </CodeGen:CodeVersion>
    <CodeGen:CodeVersion>
      <CodeGen:DynamicCode hook_ref="3" text="Assignment"/>
    </CodeGen:CodeVersion>
    <CodeGen:CodeVersion>
      <CodeGen:DynamicCode hook_ref="3" text="AssignmentLHS"/>
    </CodeGen:CodeVersion>
    <CodeGen:CodeVersion>
      <CodeGen:DynamicCode hook_ref="3" text="AssignmentRHS"/>
    </CodeGen:CodeVersion>
    <CodeGen:CodeVersion>
      <CodeGen:DynamicCode hook_ref="3" text="BasicBlock"/>
    </CodeGen:CodeVersion>
    <CodeGen:CodeVersion>
      <CodeGen:DynamicCode hook_ref="3" text="BooleanOperation"/>
    </CodeGen:CodeVersion>
    <CodeGen:CodeVersion>
      <CodeGen:DynamicCode hook_ref="3" text="CallGraph"/>
    </CodeGen:CodeVersion>
    <CodeGen:CodeVersion>
      <CodeGen:DynamicCode hook_ref="3" text="CallGraphEdge"/>
    </CodeGen:CodeVersion>
    <CodeGen:CodeVersion>
      <CodeGen:DynamicCode hook_ref="3" text="Condition"/>
    </CodeGen:CodeVersion>
    <CodeGen:CodeVersion>
      <CodeGen:DynamicCode hook_ref="3" text="Constant"/>
    </CodeGen:CodeVersion>
    <CodeGen:CodeVersion>
      <CodeGen:DynamicCode hook_ref="3" text="ControlFlowGraph"/>
    </CodeGen:CodeVersion>
    <CodeGen:CodeVersion>
      <CodeGen:DynamicCode hook_ref="3" text="ControlFlowGraphEdge"/>
    </CodeGen:CodeVersion>
    <CodeGen:CodeVersion>
      <CodeGen:DynamicCode hook_ref="3" text="Entry"/>
    </CodeGen:CodeVersion>
    <CodeGen:CodeVersion>
      <CodeGen:DynamicCode hook_ref="3" text="Exit"/>
    </CodeGen:CodeVersion>
    <CodeGen:CodeVersion>
      <CodeGen:DynamicCode hook_ref="3" text="ExpressionEdge"/>
    </CodeGen:CodeVersion>
    <CodeGen:CodeVersion>
      <CodeGen:DynamicCode hook_ref="3" text="ForLoop"/>
    </CodeGen:CodeVersion>
    <CodeGen:CodeVersion>
      <CodeGen:DynamicCode hook_ref="3" text="IfStatement"/>
    </CodeGen:CodeVersion>
    <CodeGen:CodeVersion>
      <CodeGen:DynamicCode hook_ref="3" text="Initialization"/>
    </CodeGen:CodeVersion>
    <CodeGen:CodeVersion>
      <CodeGen:DynamicCode hook_ref="3" text="Intrinsic"/>
    </CodeGen:CodeVersion>
    <CodeGen:CodeVersion>
      <CodeGen:DynamicCode hook_ref="3" text="Marker"/>
    </CodeGen:CodeVersion>
    <CodeGen:CodeVersion>
      <CodeGen:DynamicCode hook_ref="3" text="PostLoop"/>
    </CodeGen:CodeVersion>
    <CodeGen:CodeVersion>
      <CodeGen:DynamicCode hook_ref="3" text="PreLoop"/>
    </CodeGen:CodeVersion>
    <CodeGen:CodeVersion>
      <CodeGen:DynamicCode hook_ref="3" text="Scope"/>
    </CodeGen:CodeVersion>
    <CodeGen:CodeVersion>
      <CodeGen:DynamicCode hook_ref="3" text="ScopeContainment"/>
    </CodeGen:CodeVersion>
    <CodeGen:CodeVersion>
      <CodeGen:DynamicCode hook_ref="3" text="Scopes"/>
    </CodeGen:CodeVersion>
    <CodeGen:CodeVersion>
      <CodeGen:DynamicCode hook_ref="3" text="SubroutineCall"/>
    </CodeGen:CodeVersion>
    <CodeGen:CodeVersion>
      <CodeGen:DynamicCode hook_ref="3" text="SymbolReference"/>
    </CodeGen:CodeVersion>
    <CodeGen:CodeVersion>
      <CodeGen:DynamicCode hook_ref="3" text="Symbol"/>
    </CodeGen:CodeVersion>
    <CodeGen:CodeVersion>
      <CodeGen:DynamicCode hook_ref="3" text="SymbolTable"/>
    </CodeGen:CodeVersion>
    <CodeGen:CodeVersion>
      <CodeGen:DynamicCode hook_ref="3" text="Update"/>
    </CodeGen:CodeVersion>
    <CodeGen:CodeVersion>
      <CodeGen:DynamicCode hook_ref="3" text="Variable"/>
    </CodeGen:CodeVersion>
    <CodeGen:CodeVersion>
      <CodeGen:DynamicCode hook_ref="3" text="VariableEdge"/>
    </CodeGen:CodeVersion>
    <CodeGen:CodeVersion>
      <CodeGen:DynamicCode hook_ref="3" text="Dummy"/>
    </CodeGen:CodeVersion>
  </CodeGen:RepeatableCode>
</CodeGen:Document>
